{
  "$schema": "./stage-world.catalog.schema.json",
  "schemaVersion": "1.0.0-prototype",
  "catalogSha256": "b8bb0fc5ef3ab0399c8137b34a63c118c7a219eb8fe4af059ccc30b914dacf3f",
  "normalization": "recursive-key-sort UTF-8 JSON without whitespace; omit top-level catalogSha256",
  "coordinateSystem": {
    "authoring": "Blender Z-up metres",
    "runtime": "glTF Y-up",
    "origin": "stage centre ground Z=0"
  },
  "contracts": {
    "exactStageCount": 31,
    "exactLandmarksPerStage": 2,
    "exactUniqueLandmarkIds": 62,
    "visualEnvelopeSeparatedFromCollisionFootprint": true,
    "legacyVistaUncounted": true,
    "gameplayCollisionRemainsTypeScriptAuthoritative": true
  },
  "stages": [
    {
      "id": "kunren",
      "name": "訓練場",
      "referenceImage": "kunren-reference-v1.png",
      "mapSizeM": {
        "current": 310,
        "recommended": 310,
        "compactExceptionRequired": false
      },
      "identity": {
        "brief": "広大な現役軍事射撃場。管制塔、格納庫、レーダー、射線別のコンクリート防壁。",
        "surface": "range-concrete",
        "boundary": "range-earthworks",
        "skyline": "military-campus",
        "dominantSilhouette": "左の段状レーダー指揮堡と右の巨大半円アーチ格納庫が山稜を二分する軍事軸線",
        "uniqueKit": "傾斜PC隅部、外階段塔、レーダー架台、装甲連絡橋"
      },
      "districtGrammar": {
        "ordinaryFloors": [
          3,
          6
        ],
        "massPattern": "4–6階の兵舎・整備棟を斜行射撃路へ段状配置し、3階の低棟は射線の肩だけに限定",
        "targetBuildingCount": [
          22,
          28
        ],
        "blockPattern": "射線をずらした長方形兵舎ブロックと斜行する装甲サービス路",
        "tallBuildingMajority": true
      },
      "routes": {
        "primaryM": [
          14,
          18
        ],
        "alleyM": [
          6,
          8
        ],
        "combatFlow": "中央射撃路→ランプ分岐→格納庫床・指揮堡車庫・屋上橋の三高度",
        "openSpace": "射撃レーン2本と車両回頭地のみ"
      },
      "facade": {
        "roofGrammar": "低勾配装甲屋根、鋸歯採光帯、巨大ヴォールト",
        "nonGlassAlternatives": [
          "分節格納扉",
          "深いルーバー機械室",
          "外階段踊場",
          "射撃スリット",
          "少数の奥まった管制窓"
        ],
        "entranceGrammar": "人用2.1m防爆扉と20m級格納ポータルを明確に分離",
        "materials": [
          "摩耗PC",
          "亜鉛鋼",
          "低反射ガラス",
          "黄黒安全塗装"
        ],
        "surfaceState": "乾いた粉塵、タイヤ痕、局所油染み",
        "blackWindowAvoidance": "ガラスは管制帯だけ。大面積はルーバー・扉・コンクリート凹部・開放架台へ置換",
        "maxIdenticalOpeningRun": 3,
        "minimumPhysicalRecessM": 0.12,
        "lod2WindowCards": 0
      },
      "lod": {
        "lod0Preserve": [
          "格納庫アーチと内部トラス",
          "レーダー冠",
          "接地階段・橋・入口"
        ],
        "lod1Preserve": [
          "主リブ",
          "大扉分節",
          "建物段差"
        ],
        "lod2Preserve": [
          "格納庫半円輪郭",
          "指揮堡階段形",
          "山岳境界"
        ]
      },
      "legacyVista": {
        "countedTowardLandmarkQuota": false,
        "policy": "may-remain-as-uncounted-layered-3d-vista-only",
        "rasterMatteAllowedAfterBlenderLoad": false
      },
      "landmarks": [
        {
          "id": "kunren-kurogane-command-bastion",
          "ordinal": 0,
          "legacyProfileId": "kunren-kurogane-command-bastion",
          "conceptLabel": "Command Bastion",
          "visualSignature": "横長の傾斜装甲基壇、非対称レーダー冠、道路を跨ぐ指揮橋",
          "purpose": "訓練場全域を監視するC4ISR指揮・教育複合棟",
          "placementIntent": "北西・射撃レーン終端",
          "playableContract": {
            "insideAuthoritativeBounds": true,
            "combatSpace": true,
            "entranceAndApproachRequired": true,
            "outsideVistaCannotSatisfyQuota": true
          },
          "collision": {
            "districtKind": "bunker",
            "collisionTemplate": "courtyard",
            "collisionFootprintM": {
              "width": 88,
              "depth": 56
            },
            "heightM": 49,
            "source": "migration-heuristic-explicit-review-required"
          },
          "visualEnvelopeM": {
            "width": 94,
            "depth": 60,
            "height": 49
          },
          "geometryGrammar": {
            "conceptPriority": "横長の傾斜装甲基壇、非対称レーダー冠、道路を跨ぐ指揮橋",
            "primarySilhouette": "段状の装甲基壇から非対称レーダー冠が立つ横長要塞",
            "roof": "防爆フラットルーフと鋸歯状レーダーデッキ",
            "facade": "傾斜PC防護板、深い管制窓、露出した耐震ブレース",
            "entrance": "人用2.1m防爆扉と20m級格納ポータルを明確に分離",
            "nonGlassAlternatives": [
              "分節格納扉",
              "深いルーバー機械室",
              "外階段踊場",
              "射撃スリット",
              "少数の奥まった管制窓"
            ],
            "materials": [
              "煤色プレキャスト",
              "酸化亜鉛鋼",
              "低反射管制ガラス",
              "朱色識別塗装"
            ],
            "combatFlow": [
              "地上車庫を貫く長射線",
              "中央作戦室を囲む二階回廊",
              "屋上レーダー基部へ上がる外階段"
            ]
          }
        },
        {
          "id": "kunren-hakuen-aerostat-hall",
          "ordinal": 1,
          "legacyProfileId": "kunren-hakuen-aerostat-hall",
          "conceptLabel": "Aerostat Vault Hangar",
          "visualSignature": "航空機を呑む単大アーチ、厚い外骨格リブ、開放整備内部",
          "purpose": "監視気球と大型標的機を整備する双胴高天井施設",
          "placementIntent": "南東・整備道路沿い",
          "playableContract": {
            "insideAuthoritativeBounds": true,
            "combatSpace": true,
            "entranceAndApproachRequired": true,
            "outsideVistaCannotSatisfyQuota": true
          },
          "collision": {
            "districtKind": "hangar",
            "collisionTemplate": "hall",
            "collisionFootprintM": {
              "width": 112,
              "depth": 70
            },
            "heightM": 55,
            "source": "migration-heuristic-explicit-review-required"
          },
          "visualEnvelopeM": {
            "width": 120,
            "depth": 74,
            "height": 55
          },
          "geometryGrammar": {
            "conceptPriority": "航空機を呑む単大アーチ、厚い外骨格リブ、開放整備内部",
            "primarySilhouette": "二連ヴォールトと細い係留塔が交差する巨大シルエット",
            "roof": "リブ付き双曲面ヴォールトと可動扉上の採光ランタン",
            "facade": "巨大分節扉、外付け整備足場、基壇の連続ルーバー",
            "entrance": "人用2.1m防爆扉と20m級格納ポータルを明確に分離",
            "nonGlassAlternatives": [
              "分節格納扉",
              "深いルーバー機械室",
              "外階段踊場",
              "射撃スリット",
              "少数の奥まった管制窓"
            ],
            "materials": [
              "淡灰アルミ",
              "濃紺構造鋼",
              "曇りポリカーボネート",
              "汚れたコンクリート"
            ],
            "combatFlow": [
              "扉から扉へ抜ける一階主路",
              "機体ピットを挟む左右側廊",
              "トラス下キャットウォークの高所路"
            ]
          }
        }
      ]
    },
    {
      "id": "souko",
      "name": "倉庫区",
      "referenceImage": "souko-reference-v1.png",
      "mapSizeM": {
        "current": 336,
        "recommended": 336,
        "compactExceptionRequired": false
      },
      "identity": {
        "brief": "雨上がりのコンテナ物流地区。高層倉庫、積層コンテナ、ガントリークレーン。",
        "surface": "wet-logistics",
        "boundary": "container-warehouses",
        "skyline": "port-logistics",
        "dominantSilhouette": "左の橋架けラック塔群と右の鋸歯屋根税関ターミナルが濡れた物流路を挟む門型景観",
        "uniqueKit": "モニタールーフ、橋形搬送路、縦長荷役扉、雨樋大庇"
      },
      "districtGrammar": {
        "ordinaryFloors": [
          3,
          6
        ],
        "massPattern": "荷役線へ15度ずつ振った4–6階倉庫を千鳥配置し、3階棟は交差点の視界抜きに使う",
        "targetBuildingCount": [
          24,
          32
        ],
        "blockPattern": "倉庫を直交させず荷役線に沿って15度ずつ振る千鳥ブロック",
        "tallBuildingMajority": true
      },
      "routes": {
        "primaryM": [
          16,
          20
        ],
        "alleyM": [
          7,
          9
        ],
        "combatFlow": "二本のトラック路→検査ベイ→ラック脚サービス迷路→上部検査橋",
        "openSpace": "コンテナ広場1つと車両旋回域"
      },
      "facade": {
        "roofGrammar": "鋸歯・モニター・クレーン走行桁",
        "nonGlassAlternatives": [
          "開放荷役ベイ",
          "縦ルーバー",
          "メッシュラック空隙",
          "巻上げシャッター",
          "雨庇下の人扉"
        ],
        "entranceGrammar": "番号付き大型搬送口と黄色い税関門をランドマークごとに差別化",
        "materials": [
          "濡れた亜鉛鋼",
          "赤煉瓦",
          "半透明FRP",
          "橙安全塗装"
        ],
        "surfaceState": "雨水膜、排水溝、泥タイヤ跡",
        "blackWindowAvoidance": "黒ガラス帯を禁止し、奥行きあるラック・半開き扉・庇下照明・半透明FRPで暗部を作る",
        "maxIdenticalOpeningRun": 3,
        "minimumPhysicalRecessM": 0.12,
        "lod2WindowCards": 0
      },
      "lod": {
        "lod0Preserve": [
          "ラック塔の透過骨格",
          "鋸歯稜線",
          "橋と検査口"
        ],
        "lod1Preserve": [
          "主ラック列",
          "屋根歯形",
          "大庇"
        ],
        "lod2Preserve": [
          "門型ラック塔",
          "鋸歯ターミナル外形",
          "港湾低層線"
        ]
      },
      "legacyVista": {
        "countedTowardLandmarkQuota": false,
        "policy": "may-remain-as-uncounted-layered-3d-vista-only",
        "rasterMatteAllowedAfterBlenderLoad": false
      },
      "landmarks": [
        {
          "id": "souko-shiosai-stackhouse",
          "ordinal": 0,
          "legacyProfileId": "souko-shiosai-stackhouse",
          "conceptLabel": "Rack-Bridge Storehouse",
          "visualSignature": "二枚の垂直ラック塔、上空クレーン橋、透ける搬送骨格",
          "purpose": "無人クレーンが垂直搬送する超高層パレット倉庫",
          "placementIntent": "西・コンテナ軸終端",
          "playableContract": {
            "insideAuthoritativeBounds": true,
            "combatSpace": true,
            "entranceAndApproachRequired": true,
            "outsideVistaCannotSatisfyQuota": true
          },
          "collision": {
            "districtKind": "warehouse",
            "collisionTemplate": "bridge",
            "collisionFootprintM": {
              "width": 104,
              "depth": 66
            },
            "heightM": 64,
            "source": "migration-heuristic-explicit-review-required"
          },
          "visualEnvelopeM": {
            "width": 110,
            "depth": 70,
            "height": 64
          },
          "geometryGrammar": {
            "conceptPriority": "二枚の垂直ラック塔、上空クレーン橋、透ける搬送骨格",
            "primarySilhouette": "二枚の薄いラック塔を橋形クレーンが束ねる門型巨構",
            "roof": "走行クレーンを露出した切欠きフラットルーフ",